{
  "name": "sentry-issue",
  "summary": "Fetch a Sentry issue's events and stack trace before triaging.",
  "capability": "observability",
  "provider": "sentry",
  "transport": {
    "kind": "mcp",
    "server": "sentry"
  },
  "mcpTools": [
    "get_issue",
    "list_events",
    "get_event"
  ],
  "references": [
    "sentry-tools.md"
  ]
}
